Test configuration changed. Regenerating backend.
 0:08.93 INFO Found node at /usr/bin/nodejs
 0:08.93 INFO Found moz-http2 at /home/mozilla-unified/testing/xpcshell/moz-http2/moz-http2.js
 0:09.51 INFO Found /home/mozilla-unified/obj-x86_64-pc-linux-gnu/dist/bin/http3server
 0:09.51 INFO Using /home/mozilla-unified/netwerk/test/http3serverDB
 0:09.54 INFO Running tests sequentially.
 0:09.54 SUITE_START: xpcshell - running 1 tests
 0:09.54 INFO profile dir is /tmp/firefox/xpcshellprofile
 0:09.54 TEST_START: netwerk/test/URLTestFiles/test_URIs_3.js
 0:09.54 INFO netwerk/test/URLTestFiles/test_URIs_3.js | full command: ['/home/mozilla-unified/obj-x86_64-pc-linux-gnu/dist/bin/xpcshell', '-g', '/home/mozilla-unified/obj-x86_64-pc-linux-gnu/dist/bin', '-a', '/home/mozilla-unified/obj-x86_64-pc-linux-gnu/dist/bin', '-m', '-e', 'const _HEAD_JS_PATH = "/home/mozilla-unified/testing/xpcshell/head.js";', '-e', 'const _MOZINFO_JS_PATH = "/tmp/firefox/xpcshellprofile/mozinfo.json";', '-e', 'const _PREFS_FILE = "/home/mozilla-unified/obj-x86_64-pc-linux-gnu/temp/user.js";', '-e', 'const _TESTING_MODULES_DIR = "/home/mozilla-unified/obj-x86_64-pc-linux-gnu/_tests/modules/";', '-f', '/home/mozilla-unified/testing/xpcshell/head.js', '-p', '/home/mozilla-unified/obj-x86_64-pc-linux-gnu/temp/xpc-plugins-lornf27a', '-e', 'const _HEAD_FILES = ["/home/mozilla-unified/obj-x86_64-pc-linux-gnu/_tests/xpcshell/netwerk/test/URLTestFiles/head_channels.js", "/home/mozilla-unified/obj-x86_64-pc-linux-gnu/_tests/xpcshell/netwerk/test/URLTestFiles/head_cache.js", "/home/mozilla-unified/obj-x86_64-pc-linux-gnu/_tests/xpcshell/netwerk/test/URLTestFiles/head_cache2.js", "/home/mozilla-unified/obj-x86_64-pc-linux-gnu/_tests/xpcshell/netwerk/test/URLTestFiles/head_cookies.js"];', '-e', 'const _JSDEBUGGER_PORT = 0;', '-e', 'const _TEST_FILE = ["/home/mozilla-unified/obj-x86_64-pc-linux-gnu/_tests/xpcshell/netwerk/test/URLTestFiles/test_URIs_3.js"];', '-e', 'const _TEST_NAME = "netwerk/test/URLTestFiles/test_URIs_3.js";', '-e', '_execute_test(); quit(0);']
 0:09.54 INFO netwerk/test/URLTestFiles/test_URIs_3.js | current directory: '/home/mozilla-unified/obj-x86_64-pc-linux-gnu/_tests/xpcshell/netwerk/test/URLTestFiles'
 0:09.54 INFO netwerk/test/URLTestFiles/test_URIs_3.js | environment: ['MOZHTTP3_PORT_FAILED=34775', 'XPCSHELL_TEST_TEMP_DIR=/home/mozilla-unified/obj-x86_64-pc-linux-gnu/temp/xpc-other-u_ng7orb', 'DISPLAY=77', 'LD_LIBRARY_PATH=/home/mozilla-unified/obj-x86_64-pc-linux-gnu/dist/bin', 'MOZHTTP3_PORT_NO_RESPONSE=42715', 'XPCOM_DEBUG_BREAK=stack-and-abort', 'MOZHTTP2_PORT=43459', 'MOZ_DISABLE_SOCKET_PROCESS_SANDBOX=1', 'MOZ_WEBRENDER=0', 'MOZ_DISABLE_NONLOCAL_CONNECTIONS=1', 'MOZ_CRASHREPORTER_NO_REPORT=1', 'XPCSHELL_TEST_PROFILE_DIR=/tmp/firefox/xpcshellprofile', 'MOZ_CRASHREPORTER=1', 'MOZ_DEVELOPER_REPO_DIR=/home/mozilla-unified', 'MOZ_DISABLE_CONTENT_SANDBOX=1', 'MOZNODE_EXEC_PORT=38385', 'MOZHTTP3_PORT=37706', 'MOZ_DISABLE_SOCKET_PROCESS=1', 'MOZ_HEADLESS=1']
 0:09.54 INFO netwerk/test/URLTestFiles/test_URIs_3.js | as shell command: (cd /home/mozilla-unified/obj-x86_64-pc-linux-gnu/_tests/xpcshell/netwerk/test/URLTestFiles; MOZHTTP3_PORT_FAILED=34775 XPCSHELL_TEST_TEMP_DIR=/home/mozilla-unified/obj-x86_64-pc-linux-gnu/temp/xpc-other-u_ng7orb DISPLAY=77 LD_LIBRARY_PATH=/home/mozilla-unified/obj-x86_64-pc-linux-gnu/dist/bin MOZHTTP3_PORT_NO_RESPONSE=42715 XPCOM_DEBUG_BREAK=stack-and-abort MOZHTTP2_PORT=43459 MOZ_DISABLE_SOCKET_PROCESS_SANDBOX=1 MOZ_WEBRENDER=0 MOZ_DISABLE_NONLOCAL_CONNECTIONS=1 MOZ_CRASHREPORTER_NO_REPORT=1 XPCSHELL_TEST_PROFILE_DIR=/tmp/firefox/xpcshellprofile MOZ_CRASHREPORTER=1 MOZ_DEVELOPER_REPO_DIR=/home/mozilla-unified MOZ_DISABLE_CONTENT_SANDBOX=1 MOZNODE_EXEC_PORT=38385 MOZHTTP3_PORT=37706 MOZ_DISABLE_SOCKET_PROCESS=1 MOZ_HEADLESS=1 /home/mozilla-unified/obj-x86_64-pc-linux-gnu/dist/bin/xpcshell -g /home/mozilla-unified/obj-x86_64-pc-linux-gnu/dist/bin -a /home/mozilla-unified/obj-x86_64-pc-linux-gnu/dist/bin -m -e 'const _HEAD_JS_PATH = "/home/mozilla-unified/testing/xpcshell/head.js";' -e 'const _MOZINFO_JS_PATH = "/tmp/firefox/xpcshellprofile/mozinfo.json";' -e 'const _PREFS_FILE = "/home/mozilla-unified/obj-x86_64-pc-linux-gnu/temp/user.js";' -e 'const _TESTING_MODULES_DIR = "/home/mozilla-unified/obj-x86_64-pc-linux-gnu/_tests/modules/";' -f /home/mozilla-unified/testing/xpcshell/head.js -p /home/mozilla-unified/obj-x86_64-pc-linux-gnu/temp/xpc-plugins-lornf27a -e 'const _HEAD_FILES = ["/home/mozilla-unified/obj-x86_64-pc-linux-gnu/_tests/xpcshell/netwerk/test/URLTestFiles/head_channels.js", "/home/mozilla-unified/obj-x86_64-pc-linux-gnu/_tests/xpcshell/netwerk/test/URLTestFiles/head_cache.js", "/home/mozilla-unified/obj-x86_64-pc-linux-gnu/_tests/xpcshell/netwerk/test/URLTestFiles/head_cache2.js", "/home/mozilla-unified/obj-x86_64-pc-linux-gnu/_tests/xpcshell/netwerk/test/URLTestFiles/head_cookies.js"];' -e 'const _JSDEBUGGER_PORT = 0;' -e 'const _TEST_FILE = ["/home/mozilla-unified/obj-x86_64-pc-linux-gnu/_tests/xpcshell/netwerk/test/URLTestFiles/test_URIs_3.js"];' -e 'const _TEST_NAME = "netwerk/test/URLTestFiles/test_URIs_3.js";' -e '_execute_test(); quit(0);')
 0:10.17 pid:465 Full command: ['/home/mozilla-unified/obj-x86_64-pc-linux-gnu/dist/bin/xpcshell', '-g', '/home/mozilla-unified/obj-x86_64-pc-linux-gnu/dist/bin', '-a', '/home/mozilla-unified/obj-x86_64-pc-linux-gnu/dist/bin', '-m', '-e', 'const _HEAD_JS_PATH = "/home/mozilla-unified/testing/xpcshell/head.js";', '-e', 'const _MOZINFO_JS_PATH = "/tmp/firefox/xpcshellprofile/mozinfo.json";', '-e', 'const _PREFS_FILE = "/home/mozilla-unified/obj-x86_64-pc-linux-gnu/temp/user.js";', '-e', 'const _TESTING_MODULES_DIR = "/home/mozilla-unified/obj-x86_64-pc-linux-gnu/_tests/modules/";', '-f', '/home/mozilla-unified/testing/xpcshell/head.js', '-p', '/home/mozilla-unified/obj-x86_64-pc-linux-gnu/temp/xpc-plugins-lornf27a', '-e', 'const _HEAD_FILES = ["/home/mozilla-unified/obj-x86_64-pc-linux-gnu/_tests/xpcshell/netwerk/test/URLTestFiles/head_channels.js", "/home/mozilla-unified/obj-x86_64-pc-linux-gnu/_tests/xpcshell/netwerk/test/URLTestFiles/head_cache.js", "/home/mozilla-unified/obj-x86_64-pc-linux-gnu/_tests/xpcshell/netwerk/test/URLTestFiles/head_cache2.js", "/home/mozilla-unified/obj-x86_64-pc-linux-gnu/_tests/xpcshell/netwerk/test/URLTestFiles/head_cookies.js"];', '-e', 'const _JSDEBUGGER_PORT = 0;', '-e', 'const _TEST_FILE = ["/home/mozilla-unified/obj-x86_64-pc-linux-gnu/_tests/xpcshell/netwerk/test/URLTestFiles/test_URIs_3.js"];', '-e', 'const _TEST_NAME = "netwerk/test/URLTestFiles/test_URIs_3.js";', '-e', '_execute_test(); quit(0);']
pid:465 [CodeCoverage] Setting handlers for process 465.
 0:10.77 INFO (xpcshell/head.js) | test MAIN run_test pending (1)
 0:10.77 INFO (xpcshell/head.js) | test run_next_test 0 pending (2)
 0:10.79 INFO (xpcshell/head.js) | test MAIN run_test finished (2)
 0:10.79 INFO running event loop
 0:10.80 INFO netwerk/test/URLTestFiles/test_URIs_3.js | Starting mainTest
 0:10.80 INFO (xpcshell/head.js) | test mainTest pending (2)
 0:10.80 PASS mainTest - [mainTest : 124] "h" == "h"
 0:10.81 PASS mainTest - [mainTest : 124] "/a:/" == "/a:/"
 0:10.81 PASS mainTest - [mainTest : 124] "file" == "file"
 0:10.83 pid:465 {"url":"file://RĤ", "error":{"component":"host", "expected":"xn--r-qja", "actual":""}}
 0:10.82 ERROR componens do not match
/home/mozilla-unified/obj-x86_64-pc-linux-gnu/_tests/xpcshell/netwerk/test/URLTestFiles/test_URIs_3.js:do_check_property:121
/home/mozilla-unified/obj-x86_64-pc-linux-gnu/_tests/xpcshell/netwerk/test/URLTestFiles/test_URIs_3.js:do_test_uri_basic:182
/home/mozilla-unified/obj-x86_64-pc-linux-gnu/_tests/xpcshell/netwerk/test/URLTestFiles/test_URIs_3.js:mainTest/<:206
/home/mozilla-unified/obj-x86_64-pc-linux-gnu/_tests/xpcshell/netwerk/test/URLTestFiles/test_URIs_3.js:mainTest:203
/home/mozilla-unified/testing/xpcshell/head.js:_run_next_test/<:1627
/home/mozilla-unified/testing/xpcshell/head.js:_run_next_test:1627
/home/mozilla-unified/testing/xpcshell/head.js:run:774
/home/mozilla-unified/testing/xpcshell/head.js:_do_main:239
/home/mozilla-unified/testing/xpcshell/head.js:_execute_test:567
-e:null:1
 0:10.83 INFO exiting test
 0:10.84 pid:465 caught exception from components
 0:10.83 PASS mainTest - [mainTest : 124] "g" == "g"
 0:10.84 pid:465 {"url":"g:/<//{'", "error":{"component":"host", "expected":"{'", "actual":"NS_ERROR_FAILURE 2147500037"}}
 0:10.84 ERROR 2147500037
/home/mozilla-unified/obj-x86_64-pc-linux-gnu/_tests/xpcshell/netwerk/test/URLTestFiles/test_URIs_3.js:do_check_property:115
/home/mozilla-unified/obj-x86_64-pc-linux-gnu/_tests/xpcshell/netwerk/test/URLTestFiles/test_URIs_3.js:do_test_uri_basic:182
/home/mozilla-unified/obj-x86_64-pc-linux-gnu/_tests/xpcshell/netwerk/test/URLTestFiles/test_URIs_3.js:mainTest/<:206
/home/mozilla-unified/obj-x86_64-pc-linux-gnu/_tests/xpcshell/netwerk/test/URLTestFiles/test_URIs_3.js:mainTest:203
/home/mozilla-unified/testing/xpcshell/head.js:_run_next_test/<:1627
/home/mozilla-unified/testing/xpcshell/head.js:_run_next_test:1627
/home/mozilla-unified/testing/xpcshell/head.js:run:774
/home/mozilla-unified/testing/xpcshell/head.js:_do_main:239
/home/mozilla-unified/testing/xpcshell/head.js:_execute_test:567
-e:null:1
 0:10.84 INFO exiting test
 0:10.85 pid:465 caught exception from components
 0:10.85 PASS mainTest - [mainTest : 124] "https" == "https"
 0:10.85 PASS mainTest - [mainTest : 124] "::dcce:fbff:b9ff" == "::dcce:fbff:b9ff"
 0:10.85 PASS mainTest - [mainTest : 124] "/" == "/"
 0:10.85 PASS mainTest - [mainTest : 124] "v" == "v"
 0:10.85 pid:465 {"url":"V:/<//-", "error":{"component":"host", "expected":"-", "actual":"NS_ERROR_FAILURE 2147500037"}}
 0:10.85 ERROR 2147500037
/home/mozilla-unified/obj-x86_64-pc-linux-gnu/_tests/xpcshell/netwerk/test/URLTestFiles/test_URIs_3.js:do_check_property:115
/home/mozilla-unified/obj-x86_64-pc-linux-gnu/_tests/xpcshell/netwerk/test/URLTestFiles/test_URIs_3.js:do_test_uri_basic:182
/home/mozilla-unified/obj-x86_64-pc-linux-gnu/_tests/xpcshell/netwerk/test/URLTestFiles/test_URIs_3.js:mainTest/<:206
/home/mozilla-unified/obj-x86_64-pc-linux-gnu/_tests/xpcshell/netwerk/test/URLTestFiles/test_URIs_3.js:mainTest:203
/home/mozilla-unified/testing/xpcshell/head.js:_run_next_test/<:1627
/home/mozilla-unified/testing/xpcshell/head.js:_run_next_test:1627
/home/mozilla-unified/testing/xpcshell/head.js:run:774
/home/mozilla-unified/testing/xpcshell/head.js:_do_main:239
/home/mozilla-unified/testing/xpcshell/head.js:_execute_test:567
-e:null:1
 0:10.85 INFO exiting test
 0:10.85 pid:465 caught exception from components
 0:10.85 PASS mainTest - [mainTest : 124] "d" == "d"
 0:10.87 PASS mainTest - [mainTest : 124] "/" == "/"
 0:10.88 pid:465 {"url":"D:/</?", "error":{"component":"query", "expected":"?%EF%A0%88", "actual":"%EF%A0%88"}}
 0:10.87 ERROR componens do not match
/home/mozilla-unified/obj-x86_64-pc-linux-gnu/_tests/xpcshell/netwerk/test/URLTestFiles/test_URIs_3.js:do_check_property:121
/home/mozilla-unified/obj-x86_64-pc-linux-gnu/_tests/xpcshell/netwerk/test/URLTestFiles/test_URIs_3.js:do_test_uri_basic:185
/home/mozilla-unified/obj-x86_64-pc-linux-gnu/_tests/xpcshell/netwerk/test/URLTestFiles/test_URIs_3.js:mainTest/<:206
/home/mozilla-unified/obj-x86_64-pc-linux-gnu/_tests/xpcshell/netwerk/test/URLTestFiles/test_URIs_3.js:mainTest:203
/home/mozilla-unified/testing/xpcshell/head.js:_run_next_test/<:1627
/home/mozilla-unified/testing/xpcshell/head.js:_run_next_test:1627
/home/mozilla-unified/testing/xpcshell/head.js:run:774
/home/mozilla-unified/testing/xpcshell/head.js:_do_main:239
/home/mozilla-unified/testing/xpcshell/head.js:_execute_test:567
-e:null:1
 0:10.88 INFO exiting test
 0:10.90 pid:465 caught exception from components
 0:10.88 INFO (xpcshell/head.js) | test run_next_test 0 finished (2)
 0:10.88 INFO (xpcshell/head.js) | test run_next_test 1 pending (2)
 0:10.88 INFO (xpcshell/head.js) | test mainTest finished (2)
 0:10.88 INFO (xpcshell/head.js) | test run_next_test 1 finished (1)
 0:10.88 INFO exiting test
 0:12.39 TEST_END: Test FAIL, expected PASS. Subtests passed 10/10. Unexpected 0 - xpcshell return code: 0
 0:12.39 INFO INFO | Result summary:
 0:12.39 INFO INFO | Passed: 0
 0:12.39 INFO INFO | Failed: 1
 0:12.39 INFO INFO | Todo: 0
 0:12.39 INFO INFO | Retried: 0
 0:12.39 SUITE_END
 0:12.39 INFO Node moz-http2 server shutting down ...
 0:12.39 INFO http3Server server shutting down ...
 0:12.50 
Overall Summary
===============

xpcshell
~~~~~~~~
Ran 11 checks (10 subtests, 1 tests)
Expected results: 10
Unexpected results: 1
  test: 1 (1 fail)

Unexpected Results
------------------
netwerk/test/URLTestFiles/test_URIs_3.js
  FAIL netwerk/test/URLTestFiles/test_URIs_3.js - xpcshell return code: 0
ERROR componens do not match
/home/mozilla-unified/obj-x86_64-pc-linux-gnu/_tests/xpcshell/netwerk/test/URLTestFiles/test_URIs_3.js:do_check_property:121
/home/mozilla-unified/obj-x86_64-pc-linux-gnu/_tests/xpcshell/netwerk/test/URLTestFiles/test_URIs_3.js:do_test_uri_basic:182
/home/mozilla-unified/obj-x86_64-pc-linux-gnu/_tests/xpcshell/netwerk/test/URLTestFiles/test_URIs_3.js:mainTest/<:206
/home/mozilla-unified/obj-x86_64-pc-linux-gnu/_tests/xpcshell/netwerk/test/URLTestFiles/test_URIs_3.js:mainTest:203
/home/mozilla-unified/testing/xpcshell/head.js:_run_next_test/<:1627
/home/mozilla-unified/testing/xpcshell/head.js:_run_next_test:1627
/home/mozilla-unified/testing/xpcshell/head.js:run:774
/home/mozilla-unified/testing/xpcshell/head.js:_do_main:239
/home/mozilla-unified/testing/xpcshell/head.js:_execute_test:567
-e:null:1
ERROR 2147500037
/home/mozilla-unified/obj-x86_64-pc-linux-gnu/_tests/xpcshell/netwerk/test/URLTestFiles/test_URIs_3.js:do_check_property:115
/home/mozilla-unified/obj-x86_64-pc-linux-gnu/_tests/xpcshell/netwerk/test/URLTestFiles/test_URIs_3.js:do_test_uri_basic:182
/home/mozilla-unified/obj-x86_64-pc-linux-gnu/_tests/xpcshell/netwerk/test/URLTestFiles/test_URIs_3.js:mainTest/<:206
/home/mozilla-unified/obj-x86_64-pc-linux-gnu/_tests/xpcshell/netwerk/test/URLTestFiles/test_URIs_3.js:mainTest:203
/home/mozilla-unified/testing/xpcshell/head.js:_run_next_test/<:1627
/home/mozilla-unified/testing/xpcshell/head.js:_run_next_test:1627
/home/mozilla-unified/testing/xpcshell/head.js:run:774
/home/mozilla-unified/testing/xpcshell/head.js:_do_main:239
/home/mozilla-unified/testing/xpcshell/head.js:_execute_test:567
-e:null:1
ERROR 2147500037
/home/mozilla-unified/obj-x86_64-pc-linux-gnu/_tests/xpcshell/netwerk/test/URLTestFiles/test_URIs_3.js:do_check_property:115
/home/mozilla-unified/obj-x86_64-pc-linux-gnu/_tests/xpcshell/netwerk/test/URLTestFiles/test_URIs_3.js:do_test_uri_basic:182
/home/mozilla-unified/obj-x86_64-pc-linux-gnu/_tests/xpcshell/netwerk/test/URLTestFiles/test_URIs_3.js:mainTest/<:206
/home/mozilla-unified/obj-x86_64-pc-linux-gnu/_tests/xpcshell/netwerk/test/URLTestFiles/test_URIs_3.js:mainTest:203
/home/mozilla-unified/testing/xpcshell/head.js:_run_next_test/<:1627
/home/mozilla-unified/testing/xpcshell/head.js:_run_next_test:1627
/home/mozilla-unified/testing/xpcshell/head.js:run:774
/home/mozilla-unified/testing/xpcshell/head.js:_do_main:239
/home/mozilla-unified/testing/xpcshell/head.js:_execute_test:567
-e:null:1
ERROR componens do not match
/home/mozilla-unified/obj-x86_64-pc-linux-gnu/_tests/xpcshell/netwerk/test/URLTestFiles/test_URIs_3.js:do_check_property:121
/home/mozilla-unified/obj-x86_64-pc-linux-gnu/_tests/xpcshell/netwerk/test/URLTestFiles/test_URIs_3.js:do_test_uri_basic:185
/home/mozilla-unified/obj-x86_64-pc-linux-gnu/_tests/xpcshell/netwerk/test/URLTestFiles/test_URIs_3.js:mainTest/<:206
/home/mozilla-unified/obj-x86_64-pc-linux-gnu/_tests/xpcshell/netwerk/test/URLTestFiles/test_URIs_3.js:mainTest:203
/home/mozilla-unified/testing/xpcshell/head.js:_run_next_test/<:1627
/home/mozilla-unified/testing/xpcshell/head.js:_run_next_test:1627
/home/mozilla-unified/testing/xpcshell/head.js:run:774
/home/mozilla-unified/testing/xpcshell/head.js:_do_main:239
/home/mozilla-unified/testing/xpcshell/head.js:_execute_test:567
-e:null:1
