Test configuration changed. Regenerating backend.
 0:07.14 INFO Found node at /usr/bin/nodejs
 0:07.14 INFO Found moz-http2 at /home/mozilla-unified/testing/xpcshell/moz-http2/moz-http2.js
 0:07.62 INFO Found /home/mozilla-unified/obj-x86_64-pc-linux-gnu/dist/bin/http3server
 0:07.62 INFO Using /home/mozilla-unified/netwerk/test/http3serverDB
 0:07.67 INFO Running tests sequentially.
 0:07.67 SUITE_START: xpcshell - running 1 tests
 0:07.67 INFO profile dir is /tmp/firefox/xpcshellprofile
 0:07.68 TEST_START: netwerk/test/URLTestFiles/test_URIs_3.js
 0:07.68 INFO netwerk/test/URLTestFiles/test_URIs_3.js | full command: ['/home/mozilla-unified/obj-x86_64-pc-linux-gnu/dist/bin/xpcshell', '-g', '/home/mozilla-unified/obj-x86_64-pc-linux-gnu/dist/bin', '-a', '/home/mozilla-unified/obj-x86_64-pc-linux-gnu/dist/bin', '-m', '-e', 'const _HEAD_JS_PATH = "/home/mozilla-unified/testing/xpcshell/head.js";', '-e', 'const _MOZINFO_JS_PATH = "/tmp/firefox/xpcshellprofile/mozinfo.json";', '-e', 'const _PREFS_FILE = "/home/mozilla-unified/obj-x86_64-pc-linux-gnu/temp/user.js";', '-e', 'const _TESTING_MODULES_DIR = "/home/mozilla-unified/obj-x86_64-pc-linux-gnu/_tests/modules/";', '-f', '/home/mozilla-unified/testing/xpcshell/head.js', '-p', '/home/mozilla-unified/obj-x86_64-pc-linux-gnu/temp/xpc-plugins-l5k_5r_z', '-e', 'const _HEAD_FILES = ["/home/mozilla-unified/obj-x86_64-pc-linux-gnu/_tests/xpcshell/netwerk/test/URLTestFiles/head_channels.js", "/home/mozilla-unified/obj-x86_64-pc-linux-gnu/_tests/xpcshell/netwerk/test/URLTestFiles/head_cache.js", "/home/mozilla-unified/obj-x86_64-pc-linux-gnu/_tests/xpcshell/netwerk/test/URLTestFiles/head_cache2.js", "/home/mozilla-unified/obj-x86_64-pc-linux-gnu/_tests/xpcshell/netwerk/test/URLTestFiles/head_cookies.js"];', '-e', 'const _JSDEBUGGER_PORT = 0;', '-e', 'const _TEST_FILE = ["/home/mozilla-unified/obj-x86_64-pc-linux-gnu/_tests/xpcshell/netwerk/test/URLTestFiles/test_URIs_3.js"];', '-e', 'const _TEST_NAME = "netwerk/test/URLTestFiles/test_URIs_3.js";', '-e', '_execute_test(); quit(0);']
 0:07.68 INFO netwerk/test/URLTestFiles/test_URIs_3.js | current directory: '/home/mozilla-unified/obj-x86_64-pc-linux-gnu/_tests/xpcshell/netwerk/test/URLTestFiles'
 0:07.68 INFO netwerk/test/URLTestFiles/test_URIs_3.js | environment: ['MOZ_DEVELOPER_REPO_DIR=/home/mozilla-unified', 'MOZ_DISABLE_SOCKET_PROCESS_SANDBOX=1', 'XPCOM_DEBUG_BREAK=stack-and-abort', 'MOZHTTP3_PORT_FAILED=44806', 'MOZ_DISABLE_CONTENT_SANDBOX=1', 'DISPLAY=77', 'MOZNODE_EXEC_PORT=44581', 'MOZHTTP3_PORT_NO_RESPONSE=39446', 'MOZ_HEADLESS=1', 'MOZ_WEBRENDER=0', 'MOZ_DISABLE_NONLOCAL_CONNECTIONS=1', 'MOZ_CRASHREPORTER_NO_REPORT=1', 'LD_LIBRARY_PATH=/home/mozilla-unified/obj-x86_64-pc-linux-gnu/dist/bin', 'MOZ_DISABLE_SOCKET_PROCESS=1', 'MOZHTTP2_PORT=33579', 'XPCSHELL_TEST_TEMP_DIR=/home/mozilla-unified/obj-x86_64-pc-linux-gnu/temp/xpc-other-aa3j3vm3', 'MOZHTTP3_PORT=58806', 'XPCSHELL_TEST_PROFILE_DIR=/tmp/firefox/xpcshellprofile', 'MOZ_CRASHREPORTER=1']
 0:07.68 INFO netwerk/test/URLTestFiles/test_URIs_3.js | as shell command: (cd /home/mozilla-unified/obj-x86_64-pc-linux-gnu/_tests/xpcshell/netwerk/test/URLTestFiles; MOZ_DEVELOPER_REPO_DIR=/home/mozilla-unified MOZ_DISABLE_SOCKET_PROCESS_SANDBOX=1 XPCOM_DEBUG_BREAK=stack-and-abort MOZHTTP3_PORT_FAILED=44806 MOZ_DISABLE_CONTENT_SANDBOX=1 DISPLAY=77 MOZNODE_EXEC_PORT=44581 MOZHTTP3_PORT_NO_RESPONSE=39446 MOZ_HEADLESS=1 MOZ_WEBRENDER=0 MOZ_DISABLE_NONLOCAL_CONNECTIONS=1 MOZ_CRASHREPORTER_NO_REPORT=1 LD_LIBRARY_PATH=/home/mozilla-unified/obj-x86_64-pc-linux-gnu/dist/bin MOZ_DISABLE_SOCKET_PROCESS=1 MOZHTTP2_PORT=33579 XPCSHELL_TEST_TEMP_DIR=/home/mozilla-unified/obj-x86_64-pc-linux-gnu/temp/xpc-other-aa3j3vm3 MOZHTTP3_PORT=58806 XPCSHELL_TEST_PROFILE_DIR=/tmp/firefox/xpcshellprofile MOZ_CRASHREPORTER=1 /home/mozilla-unified/obj-x86_64-pc-linux-gnu/dist/bin/xpcshell -g /home/mozilla-unified/obj-x86_64-pc-linux-gnu/dist/bin -a /home/mozilla-unified/obj-x86_64-pc-linux-gnu/dist/bin -m -e 'const _HEAD_JS_PATH = "/home/mozilla-unified/testing/xpcshell/head.js";' -e 'const _MOZINFO_JS_PATH = "/tmp/firefox/xpcshellprofile/mozinfo.json";' -e 'const _PREFS_FILE = "/home/mozilla-unified/obj-x86_64-pc-linux-gnu/temp/user.js";' -e 'const _TESTING_MODULES_DIR = "/home/mozilla-unified/obj-x86_64-pc-linux-gnu/_tests/modules/";' -f /home/mozilla-unified/testing/xpcshell/head.js -p /home/mozilla-unified/obj-x86_64-pc-linux-gnu/temp/xpc-plugins-l5k_5r_z -e 'const _HEAD_FILES = ["/home/mozilla-unified/obj-x86_64-pc-linux-gnu/_tests/xpcshell/netwerk/test/URLTestFiles/head_channels.js", "/home/mozilla-unified/obj-x86_64-pc-linux-gnu/_tests/xpcshell/netwerk/test/URLTestFiles/head_cache.js", "/home/mozilla-unified/obj-x86_64-pc-linux-gnu/_tests/xpcshell/netwerk/test/URLTestFiles/head_cache2.js", "/home/mozilla-unified/obj-x86_64-pc-linux-gnu/_tests/xpcshell/netwerk/test/URLTestFiles/head_cookies.js"];' -e 'const _JSDEBUGGER_PORT = 0;' -e 'const _TEST_FILE = ["/home/mozilla-unified/obj-x86_64-pc-linux-gnu/_tests/xpcshell/netwerk/test/URLTestFiles/test_URIs_3.js"];' -e 'const _TEST_NAME = "netwerk/test/URLTestFiles/test_URIs_3.js";' -e '_execute_test(); quit(0);')
 0:08.35 pid:464 Full command: ['/home/mozilla-unified/obj-x86_64-pc-linux-gnu/dist/bin/xpcshell', '-g', '/home/mozilla-unified/obj-x86_64-pc-linux-gnu/dist/bin', '-a', '/home/mozilla-unified/obj-x86_64-pc-linux-gnu/dist/bin', '-m', '-e', 'const _HEAD_JS_PATH = "/home/mozilla-unified/testing/xpcshell/head.js";', '-e', 'const _MOZINFO_JS_PATH = "/tmp/firefox/xpcshellprofile/mozinfo.json";', '-e', 'const _PREFS_FILE = "/home/mozilla-unified/obj-x86_64-pc-linux-gnu/temp/user.js";', '-e', 'const _TESTING_MODULES_DIR = "/home/mozilla-unified/obj-x86_64-pc-linux-gnu/_tests/modules/";', '-f', '/home/mozilla-unified/testing/xpcshell/head.js', '-p', '/home/mozilla-unified/obj-x86_64-pc-linux-gnu/temp/xpc-plugins-l5k_5r_z', '-e', 'const _HEAD_FILES = ["/home/mozilla-unified/obj-x86_64-pc-linux-gnu/_tests/xpcshell/netwerk/test/URLTestFiles/head_channels.js", "/home/mozilla-unified/obj-x86_64-pc-linux-gnu/_tests/xpcshell/netwerk/test/URLTestFiles/head_cache.js", "/home/mozilla-unified/obj-x86_64-pc-linux-gnu/_tests/xpcshell/netwerk/test/URLTestFiles/head_cache2.js", "/home/mozilla-unified/obj-x86_64-pc-linux-gnu/_tests/xpcshell/netwerk/test/URLTestFiles/head_cookies.js"];', '-e', 'const _JSDEBUGGER_PORT = 0;', '-e', 'const _TEST_FILE = ["/home/mozilla-unified/obj-x86_64-pc-linux-gnu/_tests/xpcshell/netwerk/test/URLTestFiles/test_URIs_3.js"];', '-e', 'const _TEST_NAME = "netwerk/test/URLTestFiles/test_URIs_3.js";', '-e', '_execute_test(); quit(0);']
pid:464 [CodeCoverage] Setting handlers for process 464.
 0:08.86 INFO (xpcshell/head.js) | test MAIN run_test pending (1)
 0:08.86 INFO (xpcshell/head.js) | test run_next_test 0 pending (2)
 0:08.87 INFO (xpcshell/head.js) | test MAIN run_test finished (2)
 0:08.87 INFO running event loop
 0:08.88 INFO netwerk/test/URLTestFiles/test_URIs_3.js | Starting mainTest
 0:08.88 INFO (xpcshell/head.js) | test mainTest pending (2)
 0:08.90 PASS mainTest - [mainTest : 135] "h" == "h"
 0:08.90 PASS mainTest - [mainTest : 135] "/a:/" == "/a:/"
 0:08.91 PASS mainTest - [mainTest : 135] "http" == "http"
 0:08.91 PASS mainTest - [mainTest : 135] "::" == "::"
 0:08.92 PASS mainTest - [mainTest : 135] 65355 == "65355"
 0:08.92 PASS mainTest - [mainTest : 135] "/" == "/"
 0:08.92 PASS mainTest - [mainTest : 135] "file" == "file"
 0:08.93 pid:464 {"url":"file://RĤ", "error":{"component":"host", "expected":"xn--r-qja", "actual":""}}
 0:08.93 ERROR componens do not match
/home/mozilla-unified/obj-x86_64-pc-linux-gnu/_tests/xpcshell/netwerk/test/URLTestFiles/test_URIs_3.js:do_check_property:132
/home/mozilla-unified/obj-x86_64-pc-linux-gnu/_tests/xpcshell/netwerk/test/URLTestFiles/test_URIs_3.js:do_test_uri_basic:193
/home/mozilla-unified/obj-x86_64-pc-linux-gnu/_tests/xpcshell/netwerk/test/URLTestFiles/test_URIs_3.js:mainTest/<:217
/home/mozilla-unified/obj-x86_64-pc-linux-gnu/_tests/xpcshell/netwerk/test/URLTestFiles/test_URIs_3.js:mainTest:214
/home/mozilla-unified/testing/xpcshell/head.js:_run_next_test/<:1627
/home/mozilla-unified/testing/xpcshell/head.js:_run_next_test:1627
/home/mozilla-unified/testing/xpcshell/head.js:run:774
/home/mozilla-unified/testing/xpcshell/head.js:_do_main:239
/home/mozilla-unified/testing/xpcshell/head.js:_execute_test:567
-e:null:1
 0:08.93 INFO exiting test
 0:08.94 pid:464 caught exception from components
 0:08.94 PASS mainTest - [mainTest : 135] "g" == "g"
 0:08.95 pid:464 {"url":"g:/<//{'", "error":{"component":"host", "expected":"{'", "actual":"NS_ERROR_FAILURE 2147500037"}}
 0:08.95 ERROR 2147500037
/home/mozilla-unified/obj-x86_64-pc-linux-gnu/_tests/xpcshell/netwerk/test/URLTestFiles/test_URIs_3.js:do_check_property:126
/home/mozilla-unified/obj-x86_64-pc-linux-gnu/_tests/xpcshell/netwerk/test/URLTestFiles/test_URIs_3.js:do_test_uri_basic:193
/home/mozilla-unified/obj-x86_64-pc-linux-gnu/_tests/xpcshell/netwerk/test/URLTestFiles/test_URIs_3.js:mainTest/<:217
/home/mozilla-unified/obj-x86_64-pc-linux-gnu/_tests/xpcshell/netwerk/test/URLTestFiles/test_URIs_3.js:mainTest:214
/home/mozilla-unified/testing/xpcshell/head.js:_run_next_test/<:1627
/home/mozilla-unified/testing/xpcshell/head.js:_run_next_test:1627
/home/mozilla-unified/testing/xpcshell/head.js:run:774
/home/mozilla-unified/testing/xpcshell/head.js:_do_main:239
/home/mozilla-unified/testing/xpcshell/head.js:_execute_test:567
-e:null:1
 0:08.95 INFO exiting test
 0:08.97 pid:464 caught exception from components
 0:08.97 PASS mainTest - [mainTest : 135] "https" == "https"
 0:08.97 PASS mainTest - [mainTest : 135] "::dcce:fbff:b9ff" == "::dcce:fbff:b9ff"
 0:08.97 PASS mainTest - [mainTest : 135] "/" == "/"
 0:08.97 PASS mainTest - [mainTest : 135] "v" == "v"
 0:08.97 pid:464 {"url":"V:/<//-", "error":{"component":"host", "expected":"-", "actual":"NS_ERROR_FAILURE 2147500037"}}
 0:08.97 ERROR 2147500037
/home/mozilla-unified/obj-x86_64-pc-linux-gnu/_tests/xpcshell/netwerk/test/URLTestFiles/test_URIs_3.js:do_check_property:126
/home/mozilla-unified/obj-x86_64-pc-linux-gnu/_tests/xpcshell/netwerk/test/URLTestFiles/test_URIs_3.js:do_test_uri_basic:193
/home/mozilla-unified/obj-x86_64-pc-linux-gnu/_tests/xpcshell/netwerk/test/URLTestFiles/test_URIs_3.js:mainTest/<:217
/home/mozilla-unified/obj-x86_64-pc-linux-gnu/_tests/xpcshell/netwerk/test/URLTestFiles/test_URIs_3.js:mainTest:214
/home/mozilla-unified/testing/xpcshell/head.js:_run_next_test/<:1627
/home/mozilla-unified/testing/xpcshell/head.js:_run_next_test:1627
/home/mozilla-unified/testing/xpcshell/head.js:run:774
/home/mozilla-unified/testing/xpcshell/head.js:_do_main:239
/home/mozilla-unified/testing/xpcshell/head.js:_execute_test:567
-e:null:1
 0:08.97 INFO exiting test
 0:08.97 pid:464 caught exception from components
 0:08.97 PASS mainTest - [mainTest : 135] "d" == "d"
 0:08.98 PASS mainTest - [mainTest : 135] "/" == "/"
 0:08.98 pid:464 {"url":"D:/</?", "error":{"component":"query", "expected":"?%EF%A0%88", "actual":"%EF%A0%88"}}
 0:08.98 ERROR componens do not match
/home/mozilla-unified/obj-x86_64-pc-linux-gnu/_tests/xpcshell/netwerk/test/URLTestFiles/test_URIs_3.js:do_check_property:132
/home/mozilla-unified/obj-x86_64-pc-linux-gnu/_tests/xpcshell/netwerk/test/URLTestFiles/test_URIs_3.js:do_test_uri_basic:196
/home/mozilla-unified/obj-x86_64-pc-linux-gnu/_tests/xpcshell/netwerk/test/URLTestFiles/test_URIs_3.js:mainTest/<:217
/home/mozilla-unified/obj-x86_64-pc-linux-gnu/_tests/xpcshell/netwerk/test/URLTestFiles/test_URIs_3.js:mainTest:214
/home/mozilla-unified/testing/xpcshell/head.js:_run_next_test/<:1627
/home/mozilla-unified/testing/xpcshell/head.js:_run_next_test:1627
/home/mozilla-unified/testing/xpcshell/head.js:run:774
/home/mozilla-unified/testing/xpcshell/head.js:_do_main:239
/home/mozilla-unified/testing/xpcshell/head.js:_execute_test:567
-e:null:1
 0:08.98 INFO exiting test
 0:08.99 pid:464 caught exception from components
 0:08.98 INFO (xpcshell/head.js) | test run_next_test 0 finished (2)
 0:08.99 INFO (xpcshell/head.js) | test run_next_test 1 pending (2)
 0:08.99 INFO (xpcshell/head.js) | test mainTest finished (2)
 0:08.99 INFO (xpcshell/head.js) | test run_next_test 1 finished (1)
 0:08.99 INFO exiting test
 0:11.69 TEST_END: Test FAIL, expected PASS. Subtests passed 14/14. Unexpected 0 - xpcshell return code: 0
 0:11.72 INFO INFO | Result summary:
 0:11.72 INFO INFO | Passed: 0
 0:11.72 INFO INFO | Failed: 1
 0:11.72 INFO INFO | Todo: 0
 0:11.72 INFO INFO | Retried: 0
 0:11.72 SUITE_END
 0:11.72 INFO Node moz-http2 server shutting down ...
 0:11.75 INFO http3Server server shutting down ...
 0:11.87 
Overall Summary
===============

xpcshell
~~~~~~~~
Ran 15 checks (14 subtests, 1 tests)
Expected results: 14
Unexpected results: 1
  test: 1 (1 fail)

Unexpected Results
------------------
netwerk/test/URLTestFiles/test_URIs_3.js
  FAIL netwerk/test/URLTestFiles/test_URIs_3.js - xpcshell return code: 0
ERROR componens do not match
/home/mozilla-unified/obj-x86_64-pc-linux-gnu/_tests/xpcshell/netwerk/test/URLTestFiles/test_URIs_3.js:do_check_property:132
/home/mozilla-unified/obj-x86_64-pc-linux-gnu/_tests/xpcshell/netwerk/test/URLTestFiles/test_URIs_3.js:do_test_uri_basic:193
/home/mozilla-unified/obj-x86_64-pc-linux-gnu/_tests/xpcshell/netwerk/test/URLTestFiles/test_URIs_3.js:mainTest/<:217
/home/mozilla-unified/obj-x86_64-pc-linux-gnu/_tests/xpcshell/netwerk/test/URLTestFiles/test_URIs_3.js:mainTest:214
/home/mozilla-unified/testing/xpcshell/head.js:_run_next_test/<:1627
/home/mozilla-unified/testing/xpcshell/head.js:_run_next_test:1627
/home/mozilla-unified/testing/xpcshell/head.js:run:774
/home/mozilla-unified/testing/xpcshell/head.js:_do_main:239
/home/mozilla-unified/testing/xpcshell/head.js:_execute_test:567
-e:null:1
ERROR 2147500037
/home/mozilla-unified/obj-x86_64-pc-linux-gnu/_tests/xpcshell/netwerk/test/URLTestFiles/test_URIs_3.js:do_check_property:126
/home/mozilla-unified/obj-x86_64-pc-linux-gnu/_tests/xpcshell/netwerk/test/URLTestFiles/test_URIs_3.js:do_test_uri_basic:193
/home/mozilla-unified/obj-x86_64-pc-linux-gnu/_tests/xpcshell/netwerk/test/URLTestFiles/test_URIs_3.js:mainTest/<:217
/home/mozilla-unified/obj-x86_64-pc-linux-gnu/_tests/xpcshell/netwerk/test/URLTestFiles/test_URIs_3.js:mainTest:214
/home/mozilla-unified/testing/xpcshell/head.js:_run_next_test/<:1627
/home/mozilla-unified/testing/xpcshell/head.js:_run_next_test:1627
/home/mozilla-unified/testing/xpcshell/head.js:run:774
/home/mozilla-unified/testing/xpcshell/head.js:_do_main:239
/home/mozilla-unified/testing/xpcshell/head.js:_execute_test:567
-e:null:1
ERROR 2147500037
/home/mozilla-unified/obj-x86_64-pc-linux-gnu/_tests/xpcshell/netwerk/test/URLTestFiles/test_URIs_3.js:do_check_property:126
/home/mozilla-unified/obj-x86_64-pc-linux-gnu/_tests/xpcshell/netwerk/test/URLTestFiles/test_URIs_3.js:do_test_uri_basic:193
/home/mozilla-unified/obj-x86_64-pc-linux-gnu/_tests/xpcshell/netwerk/test/URLTestFiles/test_URIs_3.js:mainTest/<:217
/home/mozilla-unified/obj-x86_64-pc-linux-gnu/_tests/xpcshell/netwerk/test/URLTestFiles/test_URIs_3.js:mainTest:214
/home/mozilla-unified/testing/xpcshell/head.js:_run_next_test/<:1627
/home/mozilla-unified/testing/xpcshell/head.js:_run_next_test:1627
/home/mozilla-unified/testing/xpcshell/head.js:run:774
/home/mozilla-unified/testing/xpcshell/head.js:_do_main:239
/home/mozilla-unified/testing/xpcshell/head.js:_execute_test:567
-e:null:1
ERROR componens do not match
/home/mozilla-unified/obj-x86_64-pc-linux-gnu/_tests/xpcshell/netwerk/test/URLTestFiles/test_URIs_3.js:do_check_property:132
/home/mozilla-unified/obj-x86_64-pc-linux-gnu/_tests/xpcshell/netwerk/test/URLTestFiles/test_URIs_3.js:do_test_uri_basic:196
/home/mozilla-unified/obj-x86_64-pc-linux-gnu/_tests/xpcshell/netwerk/test/URLTestFiles/test_URIs_3.js:mainTest/<:217
/home/mozilla-unified/obj-x86_64-pc-linux-gnu/_tests/xpcshell/netwerk/test/URLTestFiles/test_URIs_3.js:mainTest:214
/home/mozilla-unified/testing/xpcshell/head.js:_run_next_test/<:1627
/home/mozilla-unified/testing/xpcshell/head.js:_run_next_test:1627
/home/mozilla-unified/testing/xpcshell/head.js:run:774
/home/mozilla-unified/testing/xpcshell/head.js:_do_main:239
/home/mozilla-unified/testing/xpcshell/head.js:_execute_test:567
-e:null:1
